<?xml encoding='US-ASCII'?>

<!-- STYLEBOOK BOOK DTD -->

<!-- import the external source-specific dtd -->
<!ENTITY % externalEntity SYSTEM "sbk:/sources/entities.ent">
%externalEntity;

<!ELEMENT book (document|hidden|faqs|changes|group|external|separator)+>
<!ATTLIST book title     CDATA #REQUIRED
               copyright CDATA #IMPLIED>
               

<!ELEMENT document EMPTY>
<!ATTLIST document id     ID    #REQUIRED
                   source CDATA #REQUIRED
                   label  CDATA #REQUIRED>

<!ELEMENT hidden EMPTY>
<!ATTLIST hidden id     ID    #REQUIRED
                 source CDATA #REQUIRED>

<!ELEMENT faqs EMPTY>
<!ATTLIST faqs id     ID    #REQUIRED
               source CDATA #REQUIRED
               label  CDATA #REQUIRED>

<!ELEMENT changes EMPTY>
<!ATTLIST changes id     ID    #REQUIRED
                  source CDATA #REQUIRED
                  label  CDATA #REQUIRED>

<!ELEMENT group (entry)+>
<!ATTLIST group id    ID    #IMPLIED
                label CDATA #REQUIRED>

<!ELEMENT entry EMPTY>
<!ATTLIST entry id     ID    #REQUIRED
                source CDATA #REQUIRED>

<!ELEMENT external EMPTY>
<!ATTLIST external label CDATA #REQUIRED
                   href  CDATA #REQUIRED>
                   
<!ELEMENT separator EMPTY>

<!-- CVS $Revision: 313243 $ $Date: 1999-12-25 09:29:50 +0100 (Sat, 25 Dec 1999) $ -->